Sheet: Sheet1
A3: Date | B3: Start time | C3: End time | D3: Pause | E3: Sum | F3: Comment
A4: 2007-05-07 | B4: 9.25 | C4: 10.25 | D4: 0 | E4: of:=[.C4]-[.B4]-[.D4] -> 1 | F4: Task 1
A5: 2007-05-07 | B5: 10.75 | C5: 12.5 | D5: 0 | E5: of:=[.C5]-[.B5]-[.D5] -> 1.75 | F5: Task 1
A6: 2007-05-07 | B6: 18 | C6: 19 | D6: 0 | E6: of:=[.C6]-[.B6]-[.D6] -> 1 | F6: Task 2
A7: 2007-05-08 | B7: 9.25 | C7: 10.25 | D7: 0 | E7: of:=[.C7]-[.B7]-[.D7] -> 1 | F7: Task 2
A8: 2007-05-08 | B8: 14.5 | C8: 15.5 | D8: 0 | E8: of:=[.C8]-[.B8]-[.D8] -> 1 | F8: Task 3
A9: 2007-05-08 | B9: 8.75 | C9: 9.25 | D9: 0 | E9: of:=[.C9]-[.B9]-[.D9] -> 0.5 | F9: Task 3
A10: 2007-05-14 | B10: 21.75 | C10: 22.25 | D10: 0 | E10: of:=[.C10]-[.B10]-[.D10] -> 0.5 | F10: Task 3
A11: 2007-05-14 | B11: 22.5 | C11: 23 | D11: 0 | E11: of:=[.C11]-[.B11]-[.D11] -> 0.5 | F11: Task 3
A12: 2007-05-15 | B12: 11.75 | C12: 12.75 | D12: 0 | E12: of:=[.C12]-[.B12]-[.D12] -> 1 | F12: Task 3
A13: 2007-05-07 | B13: 10.75 | C13: 10.75 | D13: 0 | E13: of:=[.C13]-[.B13]-[.D13] -> 0 | F13: Task 1